{
  "schema": "mdg-operations-event-v1",
  "event_id": "evt_lease_acq_0001",
  "event_type": "lease_acquired_observed",
  "occurred_at": "2026-07-25T09:00:00Z",
  "observed_at": "2026-07-25T09:00:01Z",
  "actor_role": "coordinator",
  "source_system": "git-lease",
  "source_ref": "lease:synthetic",
  "source_sha256": "d4e5f60718293a4b5c6d7e8f90a1b2c3d4e5f60718293a4b5c6d7e8f90a1b2c3",
  "branch": "feat/synthetic-branch",
  "worktree": "/synthetic/worktree",
  "lease_paths": ["docs/adr", "docs/governance", "scripts/operations"],
  "metadata": { "note": "synthetic lease observation" }
}
