{
  "schema": "mdg-operations-event-v1",
  "event_id": "evt_ledger_0001",
  "event_type": "task_state_changed",
  "occurred_at": "2026-07-26T10:00:00Z",
  "observed_at": "2026-07-26T10:00:05Z",
  "task_id": "t_synthetic_ledger",
  "from_state": "ready",
  "to_state": "in_progress",
  "actor_role": "author",
  "source_system": "hermes-kanban",
  "source_ref": "board:mdg-site",
  "source_sha256": "a1b2c3d4e5f60718293a4b5c6d7e8f90a1b2c3d4e5f60718293a4b5c6d7e8f90",
  "provenance": "live_observer",
  "import_batch": null,
  "metadata": { "note": "synthetic ledger fixture" }
}
