{
  "schema": "mdg-operations-event-v1",
  "event_id": "evt_import_0001",
  "event_type": "task_state_changed",
  "occurred_at": "2026-07-15T00:49:31Z",
  "observed_at": "2026-07-25T21:30:00Z",
  "task_id": "t_synthetic_import",
  "from_state": "ready",
  "to_state": "blocked",
  "actor_role": null,
  "source_system": "hermes-kanban",
  "source_ref": "task_events:row:3",
  "source_sha256": "aa11bb22cc33dd44ee55ff6600771188aa11bb22cc33dd44ee55ff6600771188",
  "reason_code": "needs_input",
  "outcome": "blocked",
  "provenance": "historical_import",
  "import_batch": "hermes-task-events-2026-07-14",
  "metadata": { "note": "synthetic historical import from structured board log; cutoff documented" }
}
