{
  "schema": "mdg-operations-event-v1",
  "event_id": "evt_ledger_0002",
  "event_type": "task_blocked",
  "occurred_at": "2026-07-26T11:00:00Z",
  "observed_at": "2026-07-26T11:00:05Z",
  "task_id": "t_synthetic_ledger2",
  "from_state": "in_progress",
  "to_state": "blocked",
  "actor_role": "coordinator",
  "source_system": "hermes-kanban",
  "source_ref": "board:mdg-site",
  "source_sha256": "b2c3d4e5f60718293a4b5c6d7e8f90a1b2c3d4e5f60718293a4b5c6d7e8f90a1",
  "reason_code": "needs_input",
  "outcome": "blocked",
  "provenance": "live_observer",
  "import_batch": null,
  "metadata": { "note": "synthetic ledger fixture 2" }
}
