{
  "schema": "mdg-operations-event-v1",
  "event_id": "evt_first_obs_0001",
  "event_type": "task_observed",
  "occurred_at": "2026-07-25T00:00:00Z",
  "observed_at": "2026-07-25T00:00:00Z",
  "task_id": "t_preexisting0001",
  "from_state": null,
  "to_state": "in_progress",
  "actor_role": "observer",
  "source_system": "hermes-kanban",
  "source_ref": "board:mdg-site",
  "source_sha256": "b2c3d4e5f60718293a4b5c6d7e8f90a1b2c3d4e5f60718293a4b5c6d7e8f90a1",
  "outcome": "insufficient_data",
  "censoring": {
    "left_censored": true,
    "right_censored": false,
    "unknown_state_entry_time": true
  },
  "metadata": { "note": "pre-existing task; entry time unknown; occurred_at equals observed_at by rule" }
}
