{
  "schema": "mdg-operations-event-v1",
  "event_id": "evt_state_changed_0001",
  "event_type": "task_state_changed",
  "occurred_at": "2026-07-25T12:00:00Z",
  "observed_at": "2026-07-25T12:00:05Z",
  "task_id": "t_synthetic0001",
  "initiative_id": "t_synthetic_parent",
  "from_state": "ready",
  "to_state": "in_progress",
  "actor_role": "author",
  "source_system": "hermes-kanban",
  "source_ref": "board:mdg-site",
  "source_sha256": "a1b2c3d4e5f60718293a4b5c6d7e8f90a1b2c3d4e5f60718293a4b5c6d7e8f90",
  "base_sha": "546ab267347b9bffa5cbf52e98408d8e288a5430",
  "branch": "feat/synthetic-branch",
  "worktree": "/synthetic/worktree",
  "depends_on": ["t_synthetic_dep"],
  "reason_code": null,
  "outcome": null,
  "metadata": { "note": "synthetic fixture, no real data" }
}
